{
  "schema_id": "floorplan_parse",
  "schema_version": "1.1.0",
  "artifact_id": "RUN-LAYER-A-DXF-PARSE-A:floorplan_parse",
  "project_id": "layer-a-fixture",
  "run_id": "RUN-LAYER-A-DXF-PARSE-A",
  "created_at": "2026-08-10T08:02:56Z",
  "producer": {
    "agent": "plan002-floorplan-parser",
    "provider": "local",
    "model": "deterministic-python",
    "effort": "HIGH"
  },
  "inputs": [
    {
      "artifact_id": "RUN-LAYER-A-DXF-PARSE-A:project_manifest",
      "content_hash": "sha256:d43b6026195d6e18d35f8dd96ad828140cb539b7c3b35d31ac7a7b6418db5ee6"
    },
    {
      "artifact_id": "RUN-LAYER-A-DXF-PARSE-A:input_quality_report",
      "content_hash": "sha256:b8bd632473e3bb26a9a8812395e4fe37c5335614953f8d35a8138e235b34e4e2"
    }
  ],
  "content_hash": "sha256:afa14c3729957e0bc73bf4a20cd2f64a3c91bc10efd91d6257cd9c578eca0b37",
  "status": "complete",
  "errors": [],
  "payload": {
    "units": "m",
    "scale_m_per_px": null,
    "normalization": {
      "quantum_m": 0.0001,
      "source_units": "mm",
      "source_unit_scale_m": 0.001,
      "translation_m": [
        1.0,
        2.0
      ],
      "y_axis": "up",
      "source_height_px": null,
      "scale_m_per_px": null
    },
    "overlay": {
      "path": "parse/overlay.svg",
      "sha256": "sha256:a181228d482540f37de457297b23e69c4154f47c12c5b49eb9ac98a32ff2fe54"
    },
    "rooms": [
      {
        "id": "r-ab354c288e8a",
        "polygon": [
          [
            0.0,
            0.0
          ],
          [
            5.0,
            0.0
          ],
          [
            5.0,
            6.0
          ],
          [
            0.0,
            6.0
          ]
        ],
        "confidence": 1.0,
        "provenance": {
          "source_kind": "dxf",
          "source_ref": "dxf:Model/PWA-ROOM#34",
          "source_polygon": [
            [
              1000.0,
              2000.0
            ],
            [
              6000.0,
              2000.0
            ],
            [
              6000.0,
              8000.0
            ],
            [
              1000.0,
              8000.0
            ]
          ]
        }
      },
      {
        "id": "r-bea085b2f952",
        "polygon": [
          [
            5.0,
            0.0
          ],
          [
            8.0,
            0.0
          ],
          [
            8.0,
            6.0
          ],
          [
            5.0,
            6.0
          ]
        ],
        "confidence": 1.0,
        "provenance": {
          "source_kind": "dxf",
          "source_ref": "dxf:Model/PWA-ROOM#35",
          "source_polygon": [
            [
              6000.0,
              2000.0
            ],
            [
              9000.0,
              2000.0
            ],
            [
              9000.0,
              8000.0
            ],
            [
              6000.0,
              8000.0
            ]
          ]
        }
      }
    ],
    "walls": [
      {
        "id": "w-b38b11821642",
        "start": [
          0.0,
          0.0
        ],
        "end": [
          0.0,
          6.0
        ],
        "confidence": 1.0,
        "provenance": {
          "source_kind": "dxf",
          "source_ref": "dxf:Model/PWA-WALL#32",
          "source_start": [
            1000.0,
            2000.0
          ],
          "source_end": [
            1000.0,
            8000.0
          ]
        }
      },
      {
        "id": "w-8829e7c2d2cc",
        "start": [
          0.0,
          0.0
        ],
        "end": [
          8.0,
          0.0
        ],
        "confidence": 1.0,
        "provenance": {
          "source_kind": "dxf",
          "source_ref": "dxf:Model/PWA-WALL#2F",
          "source_start": [
            1000.0,
            2000.0
          ],
          "source_end": [
            9000.0,
            2000.0
          ]
        }
      },
      {
        "id": "w-0df3b64861a5",
        "start": [
          0.0,
          6.0
        ],
        "end": [
          8.0,
          6.0
        ],
        "confidence": 1.0,
        "provenance": {
          "source_kind": "dxf",
          "source_ref": "dxf:Model/PWA-WALL#31",
          "source_start": [
            1000.0,
            8000.0
          ],
          "source_end": [
            9000.0,
            8000.0
          ]
        }
      },
      {
        "id": "w-6e35a882252a",
        "start": [
          5.0,
          0.0
        ],
        "end": [
          5.0,
          6.0
        ],
        "confidence": 1.0,
        "provenance": {
          "source_kind": "dxf",
          "source_ref": "dxf:Model/PWA-WALL#33",
          "source_start": [
            6000.0,
            2000.0
          ],
          "source_end": [
            6000.0,
            8000.0
          ]
        }
      },
      {
        "id": "w-5e931339aa8f",
        "start": [
          8.0,
          0.0
        ],
        "end": [
          8.0,
          6.0
        ],
        "confidence": 1.0,
        "provenance": {
          "source_kind": "dxf",
          "source_ref": "dxf:Model/PWA-WALL#30",
          "source_start": [
            9000.0,
            2000.0
          ],
          "source_end": [
            9000.0,
            8000.0
          ]
        }
      }
    ],
    "openings": [
      {
        "id": "o-13a46a7d32db",
        "type": "window",
        "wall_id": "w-0df3b64861a5",
        "center": [
          2.0,
          6.0
        ],
        "width_m": 1.2,
        "confidence": 1.0,
        "provenance": {
          "source_kind": "dxf",
          "source_ref": "dxf:Model/PWA-WINDOW#38",
          "source_center": [
            3000.0,
            8000.0
          ],
          "source_span": [
            [
              2400.0,
              8000.0
            ],
            [
              3600.0,
              8000.0
            ]
          ]
        }
      },
      {
        "id": "o-9585ee57fe3e",
        "type": "door",
        "wall_id": "w-8829e7c2d2cc",
        "center": [
          2.5,
          0.0
        ],
        "width_m": 0.9,
        "confidence": 1.0,
        "provenance": {
          "source_kind": "dxf",
          "source_ref": "dxf:Model/PWA-DOOR#36",
          "source_center": [
            3500.0,
            2000.0
          ],
          "source_span": [
            [
              3050.0,
              2000.0
            ],
            [
              3950.0,
              2000.0
            ]
          ]
        }
      },
      {
        "id": "o-3a101c4fd203",
        "type": "door",
        "wall_id": "w-6e35a882252a",
        "center": [
          5.0,
          3.0
        ],
        "width_m": 0.9,
        "confidence": 1.0,
        "provenance": {
          "source_kind": "dxf",
          "source_ref": "dxf:Model/PWA-DOOR#37",
          "source_center": [
            6000.0,
            5000.0
          ],
          "source_span": [
            [
              6000.0,
              4550.0
            ],
            [
              6000.0,
              5450.0
            ]
          ]
        }
      },
      {
        "id": "o-378d46ae40f1",
        "type": "window",
        "wall_id": "w-5e931339aa8f",
        "center": [
          8.0,
          4.5
        ],
        "width_m": 1.2,
        "confidence": 1.0,
        "provenance": {
          "source_kind": "dxf",
          "source_ref": "dxf:Model/PWA-WINDOW#39",
          "source_center": [
            9000.0,
            6500.0
          ],
          "source_span": [
            [
              9000.0,
              5900.0
            ],
            [
              9000.0,
              7100.0
            ]
          ]
        }
      }
    ]
  }
}
