{
  "schema_id": "floorplan_annotation",
  "schema_version": "1.0.0",
  "artifact_id": "annotation-na5-sample-floorplan",
  "project_id": "na5-sample",
  "run_id": "RUN-20260810-na5-source",
  "created_at": "2026-08-10T21:00:00Z",
  "producer": {
    "agent": "orchestrator",
    "provider": "anthropic",
    "model": "claude-opus-5",
    "effort": "EXTRA"
  },
  "inputs": [],
  "content_hash": "sha256:aaa875fecf699881ccd1f8f69ecfbc3c055312a5587b25af67f12231db2db124",
  "status": "complete",
  "errors": [],
  "payload": {
    "image": {
      "source_image_ref": "project/inputs/originals/floorplan.jpg",
      "sha256": "sha256:917a5753feceb65f8401381894bfb0809bd43194879002d2aa2acb74ee80df08",
      "width_px": 842,
      "height_px": 569
    },
    "scale_m_per_px": 0.0213,
    "walls": [
      {
        "start_px": [
          35.5,
          127.5
        ],
        "end_px": [
          101.0,
          127.5
        ]
      },
      {
        "start_px": [
          101.0,
          127.5
        ],
        "end_px": [
          280.5,
          127.5
        ]
      },
      {
        "start_px": [
          280.5,
          127.5
        ],
        "end_px": [
          280.5,
          161.0
        ]
      },
      {
        "start_px": [
          280.5,
          161.0
        ],
        "end_px": [
          533.5,
          161.0
        ]
      },
      {
        "start_px": [
          533.5,
          161.0
        ],
        "end_px": [
          533.5,
          127.5
        ]
      },
      {
        "start_px": [
          533.5,
          127.5
        ],
        "end_px": [
          773.0,
          127.5
        ]
      },
      {
        "start_px": [
          773.0,
          127.5
        ],
        "end_px": [
          773.0,
          546.0
        ]
      },
      {
        "start_px": [
          773.0,
          546.0
        ],
        "end_px": [
          35.5,
          546.0
        ]
      },
      {
        "start_px": [
          35.5,
          546.0
        ],
        "end_px": [
          35.5,
          127.5
        ]
      },
      {
        "start_px": [
          35.5,
          306.5
        ],
        "end_px": [
          294.5,
          306.5
        ]
      },
      {
        "start_px": [
          35.5,
          346.5
        ],
        "end_px": [
          175.0,
          346.5
        ]
      },
      {
        "start_px": [
          175.0,
          306.5
        ],
        "end_px": [
          175.0,
          446.0
        ]
      },
      {
        "start_px": [
          294.5,
          161.0
        ],
        "end_px": [
          294.5,
          546.0
        ]
      },
      {
        "start_px": [
          294.5,
          365.5
        ],
        "end_px": [
          773.0,
          365.5
        ]
      },
      {
        "start_px": [
          155.0,
          446.0
        ],
        "end_px": [
          294.5,
          446.0
        ]
      },
      {
        "start_px": [
          155.0,
          446.0
        ],
        "end_px": [
          155.0,
          546.0
        ]
      },
      {
        "start_px": [
          533.0,
          365.5
        ],
        "end_px": [
          533.0,
          546.0
        ]
      }
    ],
    "rooms": [
      {
        "polygon_px": [
          [
            35.5,
            127.5
          ],
          [
            280.5,
            127.5
          ],
          [
            280.5,
            306.5
          ],
          [
            35.5,
            306.5
          ]
        ]
      },
      {
        "polygon_px": [
          [
            35.5,
            306.5
          ],
          [
            175.0,
            306.5
          ],
          [
            175.0,
            346.5
          ],
          [
            35.5,
            346.5
          ]
        ]
      },
      {
        "polygon_px": [
          [
            35.5,
            346.5
          ],
          [
            175.0,
            346.5
          ],
          [
            175.0,
            446.0
          ],
          [
            155.0,
            446.0
          ],
          [
            155.0,
            546.0
          ],
          [
            35.5,
            546.0
          ]
        ]
      },
      {
        "polygon_px": [
          [
            155.0,
            446.0
          ],
          [
            294.5,
            446.0
          ],
          [
            294.5,
            546.0
          ],
          [
            155.0,
            546.0
          ]
        ]
      },
      {
        "polygon_px": [
          [
            294.5,
            365.5
          ],
          [
            533.0,
            365.5
          ],
          [
            533.0,
            546.0
          ],
          [
            294.5,
            546.0
          ]
        ]
      },
      {
        "polygon_px": [
          [
            294.5,
            161.0
          ],
          [
            533.5,
            161.0
          ],
          [
            533.5,
            127.5
          ],
          [
            773.0,
            127.5
          ],
          [
            773.0,
            365.5
          ],
          [
            294.5,
            365.5
          ]
        ]
      },
      {
        "polygon_px": [
          [
            533.0,
            365.5
          ],
          [
            773.0,
            365.5
          ],
          [
            773.0,
            546.0
          ],
          [
            533.0,
            546.0
          ]
        ]
      }
    ],
    "openings": [
      {
        "type": "door",
        "wall_index": 12,
        "center_px": [
          294.5,
          425.0
        ],
        "width_m": 0.79
      },
      {
        "type": "door",
        "wall_index": 9,
        "center_px": [
          151.0,
          306.5
        ],
        "width_m": 0.83
      },
      {
        "type": "window",
        "wall_index": 5,
        "center_px": [
          570.5,
          127.5
        ],
        "width_m": 0.7
      },
      {
        "type": "window",
        "wall_index": 5,
        "center_px": [
          629.5,
          127.5
        ],
        "width_m": 0.7
      },
      {
        "type": "window",
        "wall_index": 7,
        "center_px": [
          119.5,
          546.0
        ],
        "width_m": 0.94
      },
      {
        "type": "window",
        "wall_index": 7,
        "center_px": [
          191.5,
          546.0
        ],
        "width_m": 0.94
      }
    ],
    "declared_dimensions": [
      {
        "a_px": [
          35.5,
          546.0
        ],
        "b_px": [
          773.0,
          546.0
        ],
        "length_m": 15.7088
      },
      {
        "a_px": [
          35.5,
          127.5
        ],
        "b_px": [
          35.5,
          546.0
        ],
        "length_m": 8.914
      }
    ]
  }
}
